{"schema_version":"1.0.0-fixture","fixture":true,"operational":false,"architecture_status":"IN_PROGRESS","architecture_completion_percent":65,"implementation_completion_percent":0,"production_authority":"NONE","summary":"Enigma Core, Cultural Data and Events V2 are being designed under separate acceptance gates."}